date,username,to,replies,retweets,favorites,text,geo,mentions,hashtags,id,permalink
2/13/20 18:25,acslaw,,0,0,0,"ACS has formed a #MeToo Task Force to combat sexual harassment and sexual assault issues in the legal profession, holding listening sessions around the country. We are making plans to facilitate others speaking up. Stay tuned. 2/2",,,#MeToo #MeToo,1.23E+18,https://twitter.com/acslaw/status/1228022483695132674
2/13/20 18:25,HealingFrTrauma,,0,0,0,"Hey all, you know adult ADHD maybe a result of child trauma and the ability to toggle between thoughts simultaneously is a model being explored by AI. How do I know - check my bio #MeToo",,,#MeToo #MeToo,1.23E+18,https://twitter.com/HealingFrTrauma/status/1228022315046207488
2/13/20 18:24,RvnsNest,,0,0,0,"From 1996 to 1997, four women filed sexual-harassment or discrimination suits against Bloomberg the company. Mike Bloomberg's history asks complicated questions about the intersection of politics and morality in the age of #MeToo, writes @megangarber",,@megangarber,#MeToo #MeToo,1.23E+18,https://twitter.com/RvnsNest/status/1228022249497800704
2/13/20 18:23,film_pasco,brujasdelmar,0,0,0,#UNAM #FeminicidioEmergenciaNacional #Feminicidios #MeToo ,,,#UNAM #FeminicidioEmergenciaNacional #Feminicidios #MeToo #MeToo,1.23E+18,https://twitter.com/film_pasco/status/1228021935436685313
2/13/20 18:22,bernieshinder,davidaxelrod,0,0,0,We reacted (or didn_Ñét react at all) to negative political advertising by condoning it. This is where it ends. We need a trump #metoo movement. A national asswipe.,,,#metoo #metoo,1.23E+18,https://twitter.com/bernieshinder/status/1228021686911602696
2/13/20 18:22,MediaCheck2016,Med4Pete,0,0,0,I_Ñéd do her is now a #metoo thing? How about _ÑÒI_Ñéd do him?_Ñù,,,#metoo #metoo,1.23E+18,https://twitter.com/MediaCheck2016/status/1228021636328235010
2/13/20 18:20,aimeliz318,,0,0,1,"@Donnarotunno is lawyer goals! Damn, she is so smooth. A ballsy woman who will not be intimidated; especially by the #MeToo mob. #HarveyWeinstein",,@Donnarotunno,#MeToo #MeToo #HarveyWeinstein,1.23E+18,https://twitter.com/aimeliz318/status/1228021178528358400
2/13/20 18:19,bestdayever1616,,1,1,0,Uh-Oh. Bloomie might want to reconsider things....#METOO here we come https://www.theatlantic.com/entertainment/archive/2018/09/mike-bloomberg-comments-women-metoo/570448/,,,#METOO #METOO,1.23E+18,https://twitter.com/bestdayever1616/status/1228020981878448128
2/13/20 18:19,MediaCheck2016,jonathanchait,0,0,0,Hmmmmmm. Let me guess how many of us liberal guys AND women have said _ÑÒI_Ñéd do her (or him)_Ñù. Let_Ñés see... there are about ten hot actresses Id do tomorrow if I could. #MeToo This is where me too is f_Ñéd up. Stop taking away my right to love women. I_Ñéd do her.,,,#MeToo #MeToo,1.23E+18,https://twitter.com/MediaCheck2016/status/1228020955055902726
2/13/20 18:19,corydlg,,0,0,0,"Which is fine, I_Ñém sure she has her reasons. It_Ñés my job as a man to respect the wishes of everyone around me as long as it isn_Ñét hurting anyone. It_Ñés not hard guys. #DontBeLastAugust #consentisntcomplicated #ihopisntadonedeal #metoo",,,#DontBeLastAugust #consentisntcomplicated #ihopisntadonedeal #metoo #metoo,1.23E+18,https://twitter.com/corydlg/status/1228020788273582081
2/13/20 18:18,sex_abuse_news,,0,0,0,Bishop prohibits priest from broadcasting opinion after criticizing sex abuse scandals http://www.bishop-accountability.org/AbuseTrackerArchive/2020/02/#165401 #metoo,,,#metoo #metoo,1.23E+18,https://twitter.com/sex_abuse_news/status/1228020559092559873
2/13/20 18:18,VraiChevalier,kristenluvslife,0,0,0,#MeToo !!!,,,#MeToo #MeToo,1.23E+18,https://twitter.com/VraiChevalier/status/1228020548304809985
2/13/20 18:16,triangleinv,,0,0,0,Yoga Collides with #MeToo ,,,#MeToo #MeToo,1.23E+18,https://twitter.com/triangleinv/status/1228020159543173126
2/13/20 18:16,yahoocyd,itsBlonde007,0,0,0,"Presidential Freedom of Honor Awards? WTF are you talking about? Not a fan of Weinstein but innocent until, you know? And his supporting democrats and HRC too is your problem. Or #MeToo with the #PussyGrabberInChief would bother you also.",,,#MeToo #MeToo #PussyGrabberInChief,1.23E+18,https://twitter.com/yahoocyd/status/1228020044917084160
2/13/20 18:16,DougKCarnivore,lookatDworld,1,0,0,it's called the #metoo movement... a man can simply LOOK at a woman and end up in jail...,,,#metoo #metoo,1.23E+18,https://twitter.com/DougKCarnivore/status/1228020007772282881
2/13/20 18:15,sparrowlight,,0,0,0,The #MeToo Case That Divided the Abortion-Rights Movement https://www.theatlantic.com/magazine/archive/2020/03/the-abortion-doctor-and-his-accuser/605578/ via @instapaper,,@instapaper,#MeToo #MeToo,1.23E+18,https://twitter.com/sparrowlight/status/1228019800988798976
2/13/20 18:13,ItsmeskylerB,latimesent,0,0,0,I love that sexual assault/ harassment & their coverups are just called _ÑÒ#MeToo controversy_Ñù now ,,,#MeToo #MeToo,1.23E+18,https://twitter.com/ItsmeskylerB/status/1228019375732473856
2/13/20 18:13,sex_abuse_news,,0,0,0,Ex-Ohio State Wrestler Says Rep. Jim Jordan Involved in Sexual Abuse Cover-Up - Bleacher Report https://bleacherreport.com/articles/2876074-ex-ohio-state-wrestler-says-rep-jim-jordan-involved-in-sexual-abuse-cover-up #metoo ,,,#metoo #metoo,1.23E+18,https://twitter.com/sex_abuse_news/status/1228019302533603328
2/13/20 18:13,janamonji,,0,0,1,"_ÑÉThe Banker,_Ñé #MeToo and Banking _É__É__É_ http://ageofthegeek.org/2020/02/13/the-banker-metoo-and-banking-%e2%98%86%e2%98%86%e2%98%86/",,,#MeToo #MeToo,1.23E+18,https://twitter.com/janamonji/status/1228019281947975687
2/13/20 18:12,SeimenBurum,,0,0,0,"Klopt, de seksuele mores in de jaren 60 en 70 was anders dan nu na de vertrutting onder invloed van m.n. religieuze groepen Daarbij , waarom komen die vrouwen allemaal 100 jaar later met hun aanklachten tegen #Weinstein Via de #metoo golf ? #dwdd",,,#Weinstein #metoo #metoo #dwdd,1.23E+18,https://twitter.com/SeimenBurum/status/1228019144995594243
2/13/20 18:12,MatresseMargue1,,0,0,0,Je me suis enlevÕ©e de moi-mÕ_me pour Õ©chapper aux hommes. #metoo,,,#metoo #metoo,1.23E+18,https://twitter.com/MatresseMargue1/status/1228019109792755712
2/13/20 18:12,cyllan3,JimCarrey,0,0,0,you are a creepy predator #MeToo ,,,#MeToo #MeToo,1.23E+18,https://twitter.com/cyllan3/status/1228019048916672512
2/13/20 18:12,MiddleEastTon,,0,0,0,Harvey Weinstein jury set to hear closing from #MeToo skeptic ,,,#MeToo #MeToo,1.23E+18,https://twitter.com/MiddleEastTon/status/1228019044281913344
2/13/20 18:11,klatsch_tratsch,,0,0,0,Harvey Weinstein: Jetzt macht seine AnwÕ_ltin Druck auf Jury #HarveyWeinstein #MeToo ,,,#HarveyWeinstein #MeToo #MeToo,1.23E+18,https://twitter.com/klatsch_tratsch/status/1228018800844513281
2/13/20 18:10,Jay_latne,catrevenger,1,0,0,she caused a slave trade in libya and said people who spoke out against bill clinton aren't real members of #metoo she hasnt improved lives she has ruined them,,,#metoo #metoo,1.23E+18,https://twitter.com/Jay_latne/status/1228018661287284736
2/13/20 18:10,legalfutures,,0,0,0,The law _ÑÒhas echoes_Ñù of pre #metoo film industry ,,,#metoo #metoo,1.23E+18,https://twitter.com/legalfutures/status/1228018550566199301
2/13/20 18:10,NeilMukherjeeUK,TipsOnActing,0,0,0,"@seanmukherjee69 took me to see #BombshellMovie - It was a topical film in line with the #metoo movement. The film had good intentions, not sure how well it did in the ratings. Personally I felt the film had substance and potential. #margotrobbie @CharlizeAfrica #nicolekidman",,@seanmukherjee69 @CharlizeAfrica,#BombshellMovie #metoo #metoo #margotrobbie #nicolekidman,1.23E+18,https://twitter.com/NeilMukherjeeUK/status/1228018526960734208
2/13/20 18:10,Hollywdinsdr,,0,0,0,Click for full article: https://bit.ly/2SBWIEj | The Request of a Teenage Girl: It is Time Hollywood Changed the Way it Depicted Sex &amp; Sexual Assault in Cinema/TV to Stop Harming Teenagers. | Follow on insta: @hollywoodinsider | Photo: Hollywood Insider &amp; Wikipedia #metoo ,,,#metoo #metoo,1.23E+18,https://twitter.com/Hollywdinsdr/status/1228018526029520897
2/13/20 18:10,FreeOfViolence,,0,0,0,"According to a recent survey, 25% of fundraisers who are female have experienced sexual harassment. We are fortunate to have not had these types of situations here, but this is proof that no industry is immune to sexual violence. #MeToo Read more here: ",,,#MeToo #MeToo,1.23E+18,https://twitter.com/FreeOfViolence/status/1228018525178036230
2/13/20 18:10,melbaes,juanauribep,0,0,1,#MeToo,,,#MeToo #MeToo,1.23E+18,https://twitter.com/melbaes/status/1228018522674139138
2/13/20 18:09,fussydolphin,BigAlStrood,0,0,2,"#Metoo, *A complete and utter dictatorship* with a government of nodding donkeys,",,,#Metoo #Metoo,1.23E+18,https://twitter.com/fussydolphin/status/1228018432261722112
2/13/20 18:09,jamesguill13,vicki_pope,0,0,0,But it_Ñés sad that he seems to be getting away with it ! What happened to #metoo ?,,,#metoo #metoo,1.23E+18,https://twitter.com/jamesguill13/status/1228018314653437958
2/13/20 18:09,jagodamarinic,,2,0,7,"Ich habe mal July Delpy Interviewt und sie gefragt, warum sie jetzt statt Filmen Musik macht. Sie sagte: ich gehe lieber mit MÕ_nnern meines Alter ins Bett. Und ich suche sie mir gerne selbst aus. 10 Jahre vor #MeToo",,,#MeToo #MeToo,1.23E+18,https://twitter.com/jagodamarinic/status/1228018275986092033
2/13/20 18:08,stinkytcat1,,0,0,0,Google News - The #MeToo Case That Divided the Abortion-Rights Movement _Å_@DLoesch_Å© _Å_@yesnicksearcy_Å© _Å_@AsheSchow_Å© _Å_@LarryOConnor_Å©,,@DLoesch @yesnicksearcy @AsheSchow @LarryOConnor,#MeToo #MeToo,1.23E+18,https://twitter.com/stinkytcat1/status/1228018200668975105
2/13/20 18:08,mortem_apocalyp,fernand17704066,0,0,1,Auxilio! nos estÕçn matando! #NiUnoMÕçs solo somos unos cuerpos que pueden desechar. #MeToo #ingridescamillafotos #IngridEscamillacuerpo,,,#NiUnoM #MeToo #MeToo #ingridescamillafotos #IngridEscamillacuerpo,1.23E+18,https://twitter.com/mortem_apocalyp/status/1228018064115085312
2/13/20 18:07,LibertasDHpro,MarleneKenobi,0,1,1,QuÕ© diferencia? Investigaron bien el caso?O es sÕ_lo para mÕçs seguidores. Un asesinato es eso aquÕ_ y en Roma pero las diferencias de cada caso es lo que ataÕ±e su calificaciÕ_n y juicio. #NiUnaMas #MeToo son movimientos necesarios que despuÕ©s se intentan disipar por polÕ_ticas ,,,#NiUnaMas #MeToo #MeToo,1.23E+18,https://twitter.com/LibertasDHpro/status/1228017909798244353
2/13/20 18:07,egospotami,giuliomeotti,0,0,1,Ma dai! Pensavo che dopo i predicozzi di #Sanremo2020 e il #MeToo i problemi di #femminicidio fossero finiti!,,,#Sanremo2020 #Sanremo2020 #MeToo #MeToo #femminicidio,1.23E+18,https://twitter.com/egospotami/status/1228017903687081984
2/13/20 18:07,Scooptwotimes,Ssj_Prince,1,0,0,I_Ñém not victim blaming here #metoo but....why was that all in the whip ?!,,,#metoo #metoo,1.23E+18,https://twitter.com/Scooptwotimes/status/1228017852994613249
2/13/20 18:05,Alexander_Group,,0,0,0,"Just in time for #ValentinesDay, a 4-part guide to navigating #love at the workplace in a post-#MeToo era. http://ow.ly/PPHv50ylxx3 #officeromance #officedating #workplaceromance #workhusband #workwife #employeerelations #ethics #workplacebehavior #workplacepolicies #lovecontract",,,#ValentinesDay #ValentinesDay #love #MeToo #MeToo #officeromance #officedating #workplaceromance #workhusband #workwife #employeerelations #ethics #workplacebehavior #workplacepolicies #lovecontract,1.23E+18,https://twitter.com/Alexander_Group/status/1228017284389785600
2/13/20 18:04,redpilldadpua,TheRedQuest,1,0,4,It's utterly bizarre that some women think getting wasted + sex = rape. That's not rape--it's regret. The irony of the #MeToo movement is that we're all collectively finding out that we can't believe what women say about sex &amp; relationships.,,,#MeToo #MeToo,1.23E+18,https://twitter.com/redpilldadpua/status/1228017148586389505
2/13/20 18:04,CityNewsWPG,,0,0,0,Weinstein jury set to hear closing from #MeToo skeptic ,,,#MeToo #MeToo,1.23E+18,https://twitter.com/CityNewsWPG/status/1228016997360898051
2/13/20 18:04,ivanwese,,0,0,2, 2 opciones para el DÕ_a de los Enamorados: esta nota que escribÕ_ el aÕ±o pasado sobre San ValentÕ_n en la era del #METOO (https://www.redaccion.com.ar/datos-y-curiosidades-que-no-sabias-del-dia-de-los-enamorados/ ) y una membresÕ_a en @redaccioncomar. SerÕ_a un GRAN gesto de amor y estarÕ_as apoyando al periodismo humano https://www.redaccion.com.ar/miembros/,,@redaccioncomar,#METOO #METOO,1.23E+18,https://twitter.com/ivanwese/status/1228016996891189248
2/13/20 18:03,XRPBigRed,BrexitAlex,0,0,0,#MeToo ?,,,#MeToo #MeToo,1.23E+18,https://twitter.com/XRPBigRed/status/1228016970941050884
2/13/20 18:03,MurphyYuiko,michael1701a,0,0,1,Welcome to the reason we have #MeToo,,,#MeToo #MeToo,1.23E+18,https://twitter.com/MurphyYuiko/status/1228016926850416642
2/13/20 18:03,flyguyOX,DarlaTheDarling,1,0,0,Then respect my body dimensions (of which I have no say in) and enjoy by knees hitting your back all ride. #metoo,,,#metoo #metoo,1.23E+18,https://twitter.com/flyguyOX/status/1228016869170393090
2/13/20 18:03,ArachnePress,,0,0,0,#BookTrailer #TheSignificance ofADress @Emma_Lee1 out 27Feb Launch #London 8Mar2pm #StephenLawrenceGallery @uoggalleries &amp; #Leicester Central Library @leicesterlibrar 11Mar7pm https://bit.ly/31vWBhK plRT @booksaremybag @InkSweatTears #poetry #MeToo #Refugees,,@Emma_Lee1 @uoggalleries @leicesterlibrar @booksaremybag @InkSweatTears,#BookTrailer #TheSignificance #London #StephenLawrenceGallery #Leicester #poetry #MeToo #MeToo #Refugees,1.23E+18,https://twitter.com/ArachnePress/status/1228016813985976321
2/13/20 18:03,Huskerfan5904,DrKarlynB,0,0,0,Great article. And definitely a terrible byproduct of #metoo in the loss of innocent until proven guilty.,,,#metoo #metoo,1.23E+18,https://twitter.com/Huskerfan5904/status/1228016800396238850
2/13/20 18:03,racerm,TheRoot,0,0,1,"@TheRoot is trash and so are Gayle King, Oprah, the Ambassador Rice army, and the rest of the #metoo industrial complex. Snoop backed down because they were gonna hurt him in the pocket. However black men and women are united in exposing their agenda.",,@TheRoot,#metoo #metoo,1.23E+18,https://twitter.com/racerm/status/1228016770595745792
2/13/20 18:02,cc02aa2aecb8441,Moralens_Vogter,0,0,2,#metoo,,,#metoo #metoo,1.23E+18,https://twitter.com/cc02aa2aecb8441/status/1228016724320059393
2/13/20 18:02,myguykb,atensnut,0,0,0,Michelle left out the part about being a sexual predator. #MeToo ,,,#MeToo #MeToo,1.23E+18,https://twitter.com/myguykb/status/1228016685891891207
2/13/20 18:02,CultureReframed,,1,0,0,The #MeToo Movement is Undermined by porn #CultureReframed http://ow.ly/qrO430qbtqm,,,#MeToo #MeToo #CultureReframed,1.23E+18,https://twitter.com/CultureReframed/status/1228016629352747011
2/13/20 18:01,michelle_ottawa,LaurenAratani,0,1,1,".@OttawaMarch Let's organize. Let's sing. Let's drum. Let's yell. Let's March. Saturday, March 7th. #IDW202 #endVAW #endVAWG #Patriarchy #EnoughIsEnough #TimesUp #MeToo @ORCCsupports @OCTEVAW @CAWI_IVTF @PPOttawa",,@OttawaMarch @ORCCsupports @OCTEVAW @CAWI_IVTF @PPOttawa,#IDW202 #endVAW #endVAWG #Patriarchy #EnoughIsEnough #TimesUp #MeToo #MeToo,1.23E+18,https://twitter.com/michelle_ottawa/status/1228016464977895425
2/13/20 18:01,ledbyherorg,,0,0,0,HarcÕŒlement sexuel : Qu_Ñéest-ce qui a VRAIMENT changÕ© dans les mÕ©dias depuis la ë‰ Ligue du Lol ë_ et #MeToo ? ,,,#MeToo #MeToo,1.23E+18,https://twitter.com/ledbyherorg/status/1228016284522119168
2/13/20 18:00,budish_ezra,RIBernhard,0,0,0,"Is the student a woman? If so, you should stop bullying, threatening, and aggressing her. #BelieveAllWomen #MeToo",,,#BelieveAllWomen #MeToo #MeToo,1.23E+18,https://twitter.com/budish_ezra/status/1228016212103188480
2/13/20 18:00,bluntnessmedia,,0,0,0,.@aubrybracco takes on #sexist #cannabis advertising and the #metoo movement: ,,@aubrybracco,#sexist #cannabis #metoo #metoo,1.23E+18,https://twitter.com/bluntnessmedia/status/1228016162786742272
2/13/20 18:00,SupportTaekook,ThatBrianFella,0,0,1,"The #MeToo and #TimesUp movements are ""actively engaging in the suppression of truth"" ",,,#MeToo #MeToo #TimesUp,1.23E+18,https://twitter.com/SupportTaekook/status/1228016133170700289
2/13/20 18:00,teamcoworker,,0,1,1,"""In a recently filed lawsuit, a former employee alleges Disney World wrongfully terminated her after she filed a sexual harassment claim against her supervisor."" #MeToo #TimesUp",,,#MeToo #MeToo #TimesUp,1.23E+18,https://twitter.com/teamcoworker/status/1228016131283279872
2/13/20 18:00,womapodolchuk,,0,0,0,"I_Ñém working with a bully, I_Ñém working with someone I can_Ñét stand, what do I do? #Bullying #Keeptheconversationgoing #Educate #Speakup #Mentalhealth #MEtoo",,,#Bullying #Keeptheconversationgoing #Educate #Speakup #Mentalhealth #MEtoo #MEtoo,1.23E+18,https://twitter.com/womapodolchuk/status/1228016130876375040
2/13/20 18:00,OdaStOda,SuzanneVenker,0,0,0,Why some women don't experience #metoo : _ÑÒI have always made choices from college-age on where I never drank too much. I never went home with someone I didn_Ñét know. I just never put myself in any vulnerable circumstance. Ever._Ñù ,,,#metoo #metoo,1.23E+18,https://twitter.com/OdaStOda/status/1228016086920171522
2/13/20 18:00,acaguy,,0,1,1,Add to that the anemic response to #metoo and the moral panic around cancel culture and it is clear people in power need not be accountable for their actions. The same can't be said for those at the margins of our society. Accountability remains asymmetrical and linked to power.,,,#metoo #metoo,1.23E+18,https://twitter.com/acaguy/status/1228016086827835393
2/13/20 18:00,Drawitall,,0,0,0,@jamifloyd Diary of a Radio Junkie: 1545 Days of Waking Up to the News #HarveyWeinstein #HarveyWeinsteintrial #Rape #MeToo #JessicaMann #WilliamBarr #AGBillBarr #RogerStone #DepartmentofJustice #CanadaPipelines #NoPipeline #TyendinagaMohawk #CoronavirusOutbreak #China #Drawing,,@jamifloyd,#HarveyWeinstein #HarveyWeinsteintrial #Rape #MeToo #MeToo #JessicaMann #WilliamBarr #AGBillBarr #RogerStone #DepartmentofJustice #CanadaPipelines #NoPipeline #TyendinagaMohawk #CoronavirusOutbreak #China #Drawing,1.23E+18,https://twitter.com/Drawitall/status/1228016049171423232
2/13/20 18:00,whiteshadoe1488,,0,1,0,"Joe biden is trash. ""Lying, dog-faced pony soldier"" ëè As he takes off his jacket. tuff guy. you Need a Nap. #bully #MeToo #DeepStateCorruption #flatearth #savethechildren #awareness #nasawebb",,,#bully #MeToo #MeToo #DeepStateCorruption #flatearth #savethechildren #awareness #nasawebb,1.23E+18,https://twitter.com/whiteshadoe1488/status/1228016005659725824
2/13/20 17:59,Lou_IsSoCool,stillcham,0,0,0,Save what exactly??? ....Gayle had every opportunity to ask Kobe directly when he was alive....I don_Ñét know...maybe ask him LAST YEAR...when #metoo was jumping off at the Oscars....but no she didn_Ñét...and it not like he wasn_Ñét available for an interview with her,,,#metoo #metoo,1.23E+18,https://twitter.com/Lou_IsSoCool/status/1228015944926019584
2/13/20 17:59,goldenpoppy100,AffordableREI,1,0,1,"I absolutely think we should boycott @Etnow. You would think that especially after the #metoo movement, such abusive and harassing behavior would not be tolerated and given a platform. #MeghanMarkle #PrinceHarry #HarryAndMeghan",,@etnow,#metoo #metoo #MeghanMarkle #PrinceHarry #HarryAndMeghan,1.23E+18,https://twitter.com/goldenpoppy100/status/1228015874939817984
2/13/20 17:59,GABRIELSODI,medina764,0,0,0,#metoo,,,#metoo #metoo,1.23E+18,https://twitter.com/GABRIELSODI/status/1228015812595920896
2/13/20 17:58,KadampaMyth,,0,0,0,"""allegations began to surface on the internet that Samden Gyatso had been engaging in sexual acts with a number of women over a considerable period of time [...] despite having full knowledge of this, Kelsang Gyatso had failed to act"" #Kadampa #MeToo ",,,#Kadampa #MeToo #MeToo,1.23E+18,https://twitter.com/KadampaMyth/status/1228015671340081153
2/13/20 17:58,JerryMorton,cjharrispretzer,0,0,0,#MeToo! ,,,#MeToo #MeToo,1.23E+18,https://twitter.com/JerryMorton/status/1228015621872521218
2/13/20 17:58,AlbertitoEinst1,manueltb,0,1,1,#MeToo #Sororidad,,,#MeToo #MeToo #Sororidad,1.23E+18,https://twitter.com/AlbertitoEinst1/status/1228015555073990656
2/13/20 17:58,ElisabethNofer,,0,0,0,We agree that consent is necessary #metoo right? So what about consent online &amp; #datatracking? Only a fraction of UK's websites meet #GDPR requirements for #cookies: https://bit.ly/31XxJQf #lightbeam: Google #Chrome announced to restrict 3rd party cookies,,,#metoo #metoo #datatracking #GDPR #cookies #lightbeam #Chrome,1.23E+18,https://twitter.com/ElisabethNofer/status/1228015510232731648
2/13/20 17:57,jshnlsn,SuperMarilink,0,0,0,#same #metoo,,,#same #metoo #metoo,1.23E+18,https://twitter.com/jshnlsn/status/1228015449234739201
2/13/20 17:57,GuyCox42630817,michael73uk,0,0,1,#metoo,,,#metoo #metoo,1.23E+18,https://twitter.com/GuyCox42630817/status/1228015334470438913
2/13/20 17:57,LeftistBasher,,1,1,0,#MeToo @JimCarrey Liberal hypocrite! Jim Carrey Under Fire for _ÑÉCreepy_Ñé Remark to Female Journalist While Promoting _ÑÉSonic the Hedgehog_Ñé,,@JimCarrey,#MeToo #MeToo,1.23E+18,https://twitter.com/LeftistBasher/status/1228015293928222722
2/13/20 17:56,elaphos_,DanielEllsber10,0,0,1,"And that's probably the biggest reason it will fail, bc if he's criminally liable for this everyone in Hwood will be vulnerable. Multi-billion dollar industries will not fall to #metoo",,,#metoo #metoo,1.23E+18,https://twitter.com/elaphos_/status/1228015179679571969
2/13/20 17:56,sciles79,,0,0,1,"""'Survivor' has moved on from its #MeToo scandal. She hasn't."" ",,,#MeToo #MeToo,1.23E+18,https://twitter.com/sciles79/status/1228015038746656768
2/13/20 17:56,SearcyTalk,,0,0,0,"#MeToo Movement hits Palm Beach County on March 12th! If you are interested in joining the National Council of Jewish Women for a day of thought-provoking learning, please register at the link below. @ncjwpb https://ncjwpalmbeach.org/event/metoo-symposium-at-temple-shaarei-shalom/",,@NCJWPB,#MeToo #MeToo,1.23E+18,https://twitter.com/SearcyTalk/status/1228014988297633797
2/13/20 17:55,amancaytapia,,0,0,0,"Closing arguments in the #WeinsteinTrial and even though when it started the general consensus was that he was guilty, right now it seems as if he will probably be acquitted. Anyone following ? #metoo",,,#WeinsteinTrial #metoo #metoo,1.23E+18,https://twitter.com/amancaytapia/status/1228014914817662977
2/13/20 17:55,PHMPAMERICA,,0,0,0,"#MeToo #DemocracyNow Time_Ñés Up For Harvey Weinstein? Closing Arguments Begin in Rape Trial in NYC Feb 13, 2020 Democracy Now! Closing arguments are scheduled to begin Thursday in the trial of disgraced Hollywood mogul and accused_Ñ_https://lnkd.in/gyT8jAx",,,#MeToo #MeToo #DemocracyNow,1.23E+18,https://twitter.com/PHMPAMERICA/status/1228014833607434240
2/13/20 17:55,IAmTraveller12,TalbertSwan,0,0,0,"FACTS! My my my..... #metoo are very selective, aren't they?!",,,#metoo #metoo,1.23E+18,https://twitter.com/IAmTraveller12/status/1228014759674601472
2/13/20 17:54,BHPanimalwatch,ClimateReality,0,0,1,#ClimateEmergency #MeToo ,,,#ClimateEmergency #MeToo #MeToo,1.23E+18,https://twitter.com/BHPanimalwatch/status/1228014657597820929
2/13/20 17:54,mrjustsaying,WhoWasJacko,2,0,0,Obviously he saw an opportunity to make $$$and went for it. Its an entertainment company for heavens sake. They never even donated a CENT to victims. Its purely profiteering from #MeToo and everyone is just gobbling that shit up.,,,#MeToo #MeToo,1.23E+18,https://twitter.com/mrjustsaying/status/1228014496146493446
2/13/20 17:52,Belsjke76,loesje68,0,0,1, #metoo,,,#metoo #metoo,1.23E+18,https://twitter.com/Belsjke76/status/1228014137533501442
2/13/20 17:52,unknowncookie22,,0,0,0,@Kathbum why are you excusing that horrible cretins behaviour? As an influential woman in the spotlight you should be calling his actions disgusting. In the #metoo era you @Kathbum should know better.,,@Kathbum @Kathbum,#metoo #metoo,1.23E+18,https://twitter.com/unknowncookie22/status/1228014131560828929
2/13/20 17:51,Leonardospg,aline0505,0,0,0,#metoo,,,#metoo #metoo,1.23E+18,https://twitter.com/Leonardospg/status/1228013935879696386
2/13/20 17:51,Chameleon777771,themissybyrd,0,0,0,What right do you have to start calling other people out for their behavior when you LIED about having a #MeToo moment with Dan Spilo on Season 39 just to try and get further in the game? You are a disgrace to legitimate victims of such trauma. Sit down and be quiet.,,,#MeToo #MeToo,1.23E+18,https://twitter.com/Chameleon777771/status/1228013927675514887
2/13/20 17:51,rootofall3vil,jacknjohnnie,0,0,0,Was doing this at the height of Indian #metoo and didn't realise he was being creepy then. Waah launde.,,,#metoo #metoo,1.23E+18,https://twitter.com/rootofall3vil/status/1228013889197088769
2/13/20 17:51,leoberthi,soldier60,0,0,0,#stopIslam #BanIslam #IslamVReich #Islam_is_Terrorism #stopsharia #islamophobiefake #MeToo ,,,#stopIslam #BanIslam #IslamVReich #Islam_is_Terrorism #stopsharia #islamophobiefake #MeToo #MeToo,1.23E+18,https://twitter.com/leoberthi/status/1228013786520530944
2/13/20 17:50,mcraffermi,,0,0,0,#Metoo : La femme qui accusait Philippe CaubÕŒre de viol sera jugÕ©e pour diffamation ,,,#Metoo #Metoo,1.23E+18,https://twitter.com/mcraffermi/status/1228013586318069761
2/13/20 17:50,UPPCinema,,0,0,0,"'Its message is clear: no woman is free from the patriarchy, even if she doesn't believe in it._Ñé _É€_É€_É€_É€ @IndyArts. See US #MeToo drama #Bombshell this weekend. More info: http://bit.ly/BombshellUPP",,@IndyArts,#MeToo #MeToo #Bombshell,1.23E+18,https://twitter.com/UPPCinema/status/1228013482458648576
