date,username,to,replies,retweets,favorites,text,geo,mentions,hashtags,id,permalink
2/13/20 12:01,OldDog_OldTrick,,0,0,0,He neglected the hierarchy of leftist victimology: #MeToo come before #NeverTrump Jim Carrey criticized for 'unacceptable' remarks about female journalist being on his 'bucket list' https://fxn.ws/2tSTkwJ #FoxNews,,,#MeToo #MeToo #NeverTrump #FoxNews,1.23E+18,https://twitter.com/OldDog_OldTrick/status/1227925757026013185
2/13/20 12:00,SaphelyC,,0,0,0,We stand with you! Do you stand with survivors too?__Ñ Like & Retweet #Saphely #SelfDefense #meToo #SelfProtection #SexualAssault #Kidnap #safety #protection #Survivor #Women #Men #Protecther #Entrepreneur #Business #Whattodo #Notalone #father #Husband #Safespace,,,#Saphely #SelfDefense #meToo #meToo #SelfProtection #SexualAssault #Kidnap #safety #protection #Survivor #Women #Men #Protecther #Entrepreneur #Business #Whattodo #Notalone #father #Husband #Safespace,1.23E+18,https://twitter.com/SaphelyC/status/1227925585046974464
2/13/20 12:00,Crow31Darkness,DannyShawBBC,0,0,0,#Feminism #WhiteFeminism #IntersectionalFeminism #MeToo #TimesUp #120db #WomensMarch2020 #WomensRightsAreHumanRights #WomensRights,,,#Feminism #WhiteFeminism #IntersectionalFeminism #MeToo #MeToo #TimesUp #120db #WomensMarch2020 #WomensRightsAreHumanRights #WomensRights,1.23E+18,https://twitter.com/Crow31Darkness/status/1227925580084965376
2/13/20 12:00,headlinepg,,0,1,0,"Stay Up with Hugo Best is both a smart and timely exploration of sexual politics in the #MeToo age, and the hilarious and poignant story of one young woman's stumble into adulthood, from author @SomersErin. Out now: https://fal.cn/36x20",,@SomersErin,#MeToo #MeToo,1.23E+18,https://twitter.com/headlinepg/status/1227925563698008071
2/13/20 12:00,greeenorg,,0,0,0,Weinstein Jury Set to Hear Closing From #MeToo Skeptic - https://greeen.info/?p=2886029,,,#MeToo #MeToo,1.23E+18,https://twitter.com/greeenorg/status/1227925560304832512
2/13/20 12:00,gmuny39,marclamonthill,0,0,0,"Where is her public apology to Vannessa, his family, to Lisa Leslie, and to his fans?? Good for Snoop, but does #metoo mean the men must bow down and take there threats, a la Susan Rice?",,,#metoo #metoo,1.23E+18,https://twitter.com/gmuny39/status/1227925508144365568
2/13/20 12:00,BelleRosada,,0,0,0,Read: No Needs No Explanation (Time's Up) https://ift.tt/2DcQ7eV #feminism #metoo #timesup,,,#feminism #metoo #metoo #timesup,1.23E+18,https://twitter.com/BelleRosada/status/1227925444172943363
2/13/20 12:00,drudge_tweeter,,0,0,0,Weinstein jury set to hear closing from #MeToo skeptic... ,,,#MeToo #MeToo,1.23E+18,https://twitter.com/drudge_tweeter/status/1227925401596506112
2/13/20 12:00,Ruth64933323,AP_Sports,3,2,22,"It was just a joke!! You can_Ñét even joke anymore! For him to get fired just because he was joking about that. is ridiculous! #CancelCulture all he had to do is apologize to her,but to lose his job over at ridiculous! #MeToo Sucks!!!! ",,,#CancelCulture #MeToo #MeToo,1.23E+18,https://twitter.com/Ruth64933323/status/1227925393098903554
2/13/20 12:00,CatarataLibros,,0,0,0,"'El feminismo en 35 hashtags'. Sonia Reverter, Maria Medina-Vicent @MMVicent #MeToo #YoSiTeCreo #NiUnaMenos #AbortoLegalYa #IAmMalala El hashtag permite decir hoy sin miedo algo que hace dÕ©cadas parecÕ_a impensable: ""SÕ_, yo soy feminista"". https://www.catarata.org/libro/el-feminismo-en-35-hashtags_104859/",,@MMVicent,#MeToo #MeToo #YoSiTeCreo #NiUnaMenos #AbortoLegalYa #IAmMalala,1.23E+18,https://twitter.com/CatarataLibros/status/1227925385356005376
2/13/20 11:59,Kinofenster,,0,1,0,"#Bombshell zeigt am Beispiel #FoxNews, wie sich sexueller Missbrauch in der Arbeitswelt festgefressen hat. Jay Roachs Drama basiert auf einem realen Skandal, der vor der #MeToo-Debatte fÕ_r Schlagzeilen sorgte. #Filmkritik https://www.kinofenster.de/filme/neuimkino/bombshell-film/ #twitterlehrerzimmer @bpb_de",,@bpb_de,#Bombshell #FoxNews #MeToo #MeToo #Filmkritik #twitterlehrerzimmer,1.23E+18,https://twitter.com/Kinofenster/status/1227925345057280001
2/13/20 11:59,maarianvaara,AlanSalehzadeh,1,0,0,"Valta ja vallan vÕ_Õ_rikÕ_yttÕ_ - seksuaalinen hyvÕ_ksikÕ_yttÕ_ sen yhtenÕ_ muotona - kietoutuvat valitettavan usein yhteen, kuten esimerkiksi #MeToo'n esille nostamat tapaukset nÕ_yttÕ_vÕ_t. Valta voi olla mm. taloudellista, poliittista tai uskonnollista (uskonnosta riippumatta).",,,#MeToo #MeToo,1.23E+18,https://twitter.com/maarianvaara/status/1227925231399993344
2/13/20 11:58,BlkDrgn88,YellowFlashGuy,1,0,1,"And yet, Henry Cavill gets grief for his fears of dating in the #MeToo era?? SMH. #SonicMovie",,,#MeToo #MeToo #SonicMovie #SonicMovie,1.23E+18,https://twitter.com/BlkDrgn88/status/1227925063489466368
2/13/20 11:58,drudgefeed,,0,0,0,Weinstein jury set to hear closing from #MeToo skeptic... https://goo.gl/fb/8sgoas,,,#MeToo #MeToo,1.23E+18,https://twitter.com/drudgefeed/status/1227925043990204416
2/13/20 11:57,Yur_BEST_friend,tribelaw,0,0,0,#MeToo ,,,#MeToo #MeToo,1.23E+18,https://twitter.com/Yur_BEST_friend/status/1227924771540733952
2/13/20 11:56,CitaWertz,,0,0,0,"Closing arguments at the Harvey Weinsten rape trial are set to begin Thursday, with the jury hearing first from a Chicago attorney who_Ñés taken #MeToo movement heat for representing the disgraced Hollywood mogul and making provocative mid-trial com...",,,#MeToo #MeToo,1.23E+18,https://twitter.com/CitaWertz/status/1227924428954259456
2/13/20 11:55,KellieKellie916,MaxBoot,1,0,2,The DNC clobbered Bernie for Hillary last time. Surprised they haven't tried to #metoo Bernie X 15 in the final months. Is there a Dossier. DNC could slip his opponents debate questions. So many tricks up their sleeve. Seems like Washington Post is suggesting that it's time.,,,#metoo #metoo,1.23E+18,https://twitter.com/KellieKellie916/status/1227924275262296066
2/13/20 11:54,NewDelhiTimes,,0,1,0,Weinstein jury set to hear closing from #MeToo skeptic https://www.newdelhitimes.com/weinstein-jury-set-to-hear-closing-from-metoo-skeptic/,,,#MeToo #MeToo,1.23E+18,https://twitter.com/NewDelhiTimes/status/1227924076779405312
2/13/20 11:52,IshaHashmi,irxqia,0,0,1,#Metoo ,,,#Metoo #Metoo,1.23E+18,https://twitter.com/IshaHashmi/status/1227923511265681411
2/13/20 11:52,BlogBookMark,,0,0,0,Weinstein jury set to hear closing from #MeToo skeptic https://www.blogbookmark.com/weinstein-jury-set-to-hear-closing-from-metoo-skeptic/,,,#MeToo #MeToo,1.23E+18,https://twitter.com/BlogBookMark/status/1227923429371842562
2/13/20 11:51,t_k_s_eki,,0,0,0,#MeToo  Å‰‘Ë_ Å‹ Å_ _ÑÒnot yours_Ñù  ÅÔ_èêç__ ÅÇ _Ô Å_ Å†/_èêç__ Å_ Åç Å_ Å†_ô_çÇÔ __ Å_ Åª ó_ ó© ó_ ÅÊ Å_ Ñ_ ÅŒèÑó Å_ Åª __ Å‹ Å_ Å† _Ê Ñ_ __ Å£ ÅŒç_å ÅËè__‘__ Å‰‘ê¥ Å¥ __ _Ô _Ê Å_ Åç Å_ ÑÅ______ ÅÊ __ Åè Åª _____çâç Å__ÅÇ Å† Å_ __ ÑÅè__‘__ ÅÔ Åù Å_ Å‰_ç‹ Å‚ ÅÊ Å_ Å¥ _Ô Åç ÑÅ óè óó _ˆ ó‚ _è _ç Å‰‘__‘è_ ÅÇ _Ô Å_ Å‹ Å_ Å_ Ñ_,,,#MeToo #MeToo,1.23E+18,https://twitter.com/t_k_s_eki/status/1227923281941950464
2/13/20 11:51,squala96,ChristinaAllDay,1,0,0,List of people who think this a #metoo moment: ,,,#metoo #metoo,1.23E+18,https://twitter.com/squala96/status/1227923131823616006
2/13/20 11:51,Gemadavs,CNN,0,0,0,#metoo @RBKC,,@RBKC,#metoo #metoo,1.23E+18,https://twitter.com/Gemadavs/status/1227923119828086784
2/13/20 11:50,erin_hartigan4,jenjavajunky,0,0,2,There are no words .... #MeToo I_Ñém so sorry ,,,#MeToo #MeToo,1.23E+18,https://twitter.com/erin_hartigan4/status/1227923104279732224
2/13/20 11:49,WashTimes,,0,2,0,Harvey Weinstein jury set to hear closing from #MeToo skeptic ,,,#MeToo #MeToo,1.23E+18,https://twitter.com/WashTimes/status/1227922806731681794
2/13/20 11:49,Roberto_ROC181,Polojug1,0,0,0,It_Ñés obvious because otherwise you would have said something like _ÑÒif he_Ñés guilty or not then we will see..._Ñù your statement showed that you want to be right regardless. As for people wanting to see him guilty even if he is innocent well most of the #MeToo aholes would want that!,,,#MeToo #MeToo,1.23E+18,https://twitter.com/Roberto_ROC181/status/1227922784057090048
2/13/20 11:47,FredoMueller,thehill,2,0,0,"George W Bush legacy shot, Obama legacy shot, Clinton sexual predator, George HW Bush #metoo, Donald Trump greatest president ever deal with it.",,,#metoo #metoo,1.23E+18,https://twitter.com/FredoMueller/status/1227922308326547456
2/13/20 11:45,about_dancing,aruetzel,1,0,5,"Das mit so einen Typen in Zeiten von #metoo pushen kann, ist einfach unbegreiflich fÕ_r mich, aber gut. Es ist eben @RTLde. Leider standen die immer nur fÕ_r RÕ_ckschritt, Trash und Ewiggestriges. Es wÕ_re ein gutes Zeichen, wenn RTL das Verhalten dieses Typen richtig kommentieren...",,@RTLde,#metoo #metoo,1.23E+18,https://twitter.com/about_dancing/status/1227921855752949760
2/13/20 11:44,t_k_s_eki,,1,0,0,RT ÅÊ __ Ñ_ ÑÔ ó‰ ó_ ó_ óÊ _¢ ó_ ÅÔ__ç Å£ Åª___ç__ ÅË ÑÅ #MeToo  ÅŒè©± Å‹ ÅÊ Å¥ _Ô Åç _ÑÒnot yours_Ñù  ÅŒç_Ó Å_ _Ê___ Åå Å† _Ê ó_ ó© ó_ Å_ Å_ Å£ Åª Ñ_ Ñç,,,#MeToo #MeToo,1.23E+18,https://twitter.com/t_k_s_eki/status/1227921512042156032
2/13/20 11:44,Gentlem77261027,AngelaLMorabito,0,0,0,This is why pseudo movements like Feminism and #MeToo fail because they just attack each other for not protesting in the way the each personally consider appropriate. Hilarious,,,#MeToo #MeToo,1.23E+18,https://twitter.com/Gentlem77261027/status/1227921510884610049
2/13/20 11:44,clau_dia1972,,0,1,2,"No te conocÕ_, no soy de tÕ_ paÕ_s, no compartÕ_amos redes sociales, pero somos mujeres y digo Basta de Violencia de GÕ©nero, #IngridEscamillaVargas estoy contigo #metoo #NiUnaMas",,,#IngridEscamillaVargas #metoo #metoo #NiUnaMas,1.23E+18,https://twitter.com/clau_dia1972/status/1227921426696540161
2/13/20 11:43,mbalter,,0,2,2,"U of Michigan Knew of Misconduct Allegations Against Provost [for many years, of course] #MeToo ",,,#MeToo #MeToo,1.23E+18,https://twitter.com/mbalter/status/1227921323709620227
2/13/20 11:43,WKBN,,0,0,0,Weinstein jury set to hear closing from #MeToo skeptic http://dlvr.it/RPy7jV,,,#MeToo #MeToo,1.23E+18,https://twitter.com/WKBN/status/1227921244646821889
2/13/20 11:43,men_are_human,EXPELincels,1,0,0,It very much is. An excellent example would be all those male Feminists who constantly lecture men about how they treat women and then immediately get #MeToo'd to death.,,,#MeToo #MeToo,1.23E+18,https://twitter.com/men_are_human/status/1227921175118000128
2/13/20 11:43,sex_abuse_news,,0,0,0,Il aborde les violences et abus sexuels dans ses films - POSITIVR https://positivr.fr/il-aborde-les-violences-et-abus-sexuels-dans-ses-films/ #metoo ,,,#metoo #metoo,1.23E+18,https://twitter.com/sex_abuse_news/status/1227921136085848064
2/13/20 11:41,GarryVeevers,,0,0,0,No fan of the vacuous and largely ineffective Andrea Leadsom but in her defence she took the #MeToo issue seriously and actually did something about it.,,,#MeToo #MeToo,1.23E+18,https://twitter.com/GarryVeevers/status/1227920742446247936
2/13/20 11:40,tazgezwitscher,,0,1,4,Ein Rechtsstreit nach #MeToo-EnthÕ_llungen gegen den Regisseur Dieter Wedel geht weiter. Nun geht es um die Rolle von Medienanwalt Christian Schertz. mehr... ,,,#MeToo #MeToo,1.23E+18,https://twitter.com/tazgezwitscher/status/1227920357715316736
2/13/20 11:38,Science_Open,,1,2,0,_ÑÉ_ÑÒSeeing the Actual Physical Betty Kane_Ñù: Reading the Fille Fatale in Josephine Tey_Ñés The Franchise Affair in the Age of #metoo_Ñé @openlibhums #openaccess article on #ScienceOpen: https://www.scienceopen.com/document?vid=8ad4e8b9-a5c9-4b55-ab35-50d9948dbecd,,@openlibhums,#metoo #metoo #openaccess #ScienceOpen,1.23E+18,https://twitter.com/Science_Open/status/1227920076747218944
2/13/20 11:37,alanatpaterra,japanonmymind,0,0,0,"BTW, can you recommend any JP or CN authors who have treated #MeToo in fiction? Original JA or ZH preferred. Thanks.",,,#MeToo #MeToo,1.23E+18,https://twitter.com/alanatpaterra/status/1227919839638904833
2/13/20 11:37,TFASIsland,atheist_bad,0,0,0,"If the _ÑÒstory_Ñù of Mary was true, she_Ñés be the earliest case of #MeToo for sure!",,,#MeToo #MeToo,1.23E+18,https://twitter.com/TFASIsland/status/1227919731736350720
2/13/20 11:37,Kiran_MH,,1,1,2,"So enjoyed this chat with @paperalphabet about #TheMercies, #MeToo, &amp; historical fiction as contemporary reflection. Thank you Kristen &amp; @KirkusReviews!",,@paperalphabet @KirkusReviews,#TheMercies #MeToo #MeToo,1.23E+18,https://twitter.com/Kiran_MH/status/1227919676782645249
2/13/20 11:37,krAsians,,0,0,0,U.K. Regulators Examine Ties Between Barclays C.E.O. James Staley and Jeffrey Epstein _Å_@Barclays_Å© _Å_@BarclaysUK_Å© #MeToo ,,@Barclays @BarclaysUK,#MeToo #MeToo,1.23E+18,https://twitter.com/krAsians/status/1227919636047388672
2/13/20 11:35,GirlsBurnTrump,morningmika,0,0,0,"Snoop apologized, which is MORE than you and your #MeToo you married did to millions of us for your part in bringing us the #CriminalInChief. You OWE us an APOLOGY.",,,#MeToo #MeToo #CriminalInChief,1.23E+18,https://twitter.com/GirlsBurnTrump/status/1227919291548303360
2/13/20 11:33,daimthander,ayako_teacher_,0,0,0,#MeToo #metoo ,,,#MeToo #MeToo #metoo #metoo,1.23E+18,https://twitter.com/daimthander/status/1227918823744921600
2/13/20 11:33,40k_slimez,kingzebor,0,0,0,#MeToo,,,#MeToo #MeToo,1.23E+18,https://twitter.com/40k_slimez/status/1227918744401448960
2/13/20 11:33,GlenMonks1,Sigur_Karm,0,0,0,"It proper boils my piss that jerk offs like him get to be predatory misogynists on stage and this angle barely features in media coverage. Like it_Ñés not an issue. Like women and girls don_Ñét have to stand this shit day-in, day-out. Anyone for #MeToo? ",,,#MeToo #MeToo,1.23E+18,https://twitter.com/GlenMonks1/status/1227918645440937984
2/13/20 11:32,tt3091,,0,0,0,"Closing arguments at the Harvey Weinsten rape trial are set to begin Thursday, with the jury hearing first from a Chicago attorney who_Ñés taken #MeToo movement heat for representing the disgraced Hollywood mogul and making provocative mid-trial comments about his case outside of",,,#MeToo #MeToo,1.23E+18,https://twitter.com/tt3091/status/1227918436266913792
2/13/20 11:30,dragonfly_sima,,0,0,0,https://togetter.com/li/1398032  ó_ ó_ _Î ÑÔç_Å Ååè_‰ Å‰èµˆ Åç Åª Å_ ÅŒ Ñç«__ ÅŒ Å_ _Ê __ __ _ç ó‰___‘‚__Ñ_ ÅåèŒ_èŒÑ«__ 2/5 # __ __ _ç ó‰ #__çç__ __ __ _ç ó‰è_____‘Ô_ #_ù± ó_ ó‰ __ __ _è ó_ #MeToo #FreeUyghur #_ô_‘__ #_ô_‘__‘€±çÓ£‘€_ #____Œ© #____Œ©‘Çè_çÔ,,,#MeToo #MeToo #FreeUyghur,1.23E+18,https://twitter.com/dragonfly_sima/status/1227918035014619136
2/13/20 11:30,cuts_podcast,,0,1,9,"Noch vor #MeToo hat dieser Fall die US-Medienwelt erschÕ_ttert. #Bombshell thematisiert das heute im Kino. Die groÕªartigen @laloeffelstiel von @BuzzFeedNewsDE &amp; @samelou von @uebermedien diskutieren mit @chr_eichler, ob das gelungen ist. https://bit.ly/37scirv",,@laloeffelstiel @BuzzFeedNewsDE @samelou @uebermedien @chr_eichler,#MeToo #MeToo #Bombshell,1.23E+18,https://twitter.com/cuts_podcast/status/1227918001405603840
2/13/20 11:29,SUREWORD5511,praisegeorge,1,0,1,I don't know why #feminist s and the #metoo ladies don't stop this and protect their sisters.,,,#feminist #metoo #metoo,1.23E+18,https://twitter.com/SUREWORD5511/status/1227917642352201733
2/13/20 11:29,WOWK13News,,0,2,0,Weinstein jury set to hear closing from #MeToo skeptic ,,,#MeToo #MeToo,1.23E+18,https://twitter.com/WOWK13News/status/1227917602317578240
2/13/20 11:25,chelseyglasson,,1,5,126,"You're not the only one, @justkelly_ok. #metoo",,@justkelly_ok,#metoo #metoo,1.23E+18,https://twitter.com/chelseyglasson/status/1227916751528058880
2/13/20 11:25,Iinda_peters,kwastopzee,0,0,0,Me too! #metoo,,,#metoo #metoo,1.23E+18,https://twitter.com/Iinda_peters/status/1227916741793239041
2/13/20 11:25,MichaelJadasky,DrKarlynB,0,0,0,Here's the dark side..No corporation will hire men in top positions. Who would think #metoo had a agenda...glass ceiling.,,,#metoo #metoo,1.23E+18,https://twitter.com/MichaelJadasky/status/1227916604945518597
2/13/20 11:24,SkygaL,,0,0,0,Actor Alleges Pedophilia Is Hollywood's Biggest Problem - Not #MeToo https://pin.it/vHzq1mz via @pinterest,,@Pinterest,#MeToo #MeToo,1.23E+18,https://twitter.com/SkygaL/status/1227916438603694086
2/13/20 11:24,Terrafemina,,0,2,5,Comment la rÕ©sistance #MeToo s'organise face au scandale Polanski aux CÕ©sar https://www.terrafemina.com/article/cesar-2020-comment-la-resistance-metoo-s-organise-face-au-scandale-polanski_a352477/1,,,#MeToo #MeToo,1.23E+18,https://twitter.com/Terrafemina/status/1227916380785315842
2/13/20 11:22,Theaterleben,,0,0,2,#metoo - AEKMMN https://youtu.be/hEyeEFSFaOA via @YouTube,,@YouTube,#metoo #metoo,1.23E+18,https://twitter.com/Theaterleben/status/1227915986864627712
2/13/20 11:20,TheEnglishGit2,RitaPanahi,0,0,0,"Disagreeing with me is a violation of something or other (#MeToo), and probably anti-semitism too",,,#MeToo #MeToo,1.23E+18,https://twitter.com/TheEnglishGit2/status/1227915508969857024
2/13/20 11:20,wiese_r,PhilipPlickert,0,0,0,Rufmord a la #MeToo Zweite Welle. Was genau soll der Vorwurf sein?,,,#MeToo #MeToo,1.23E+18,https://twitter.com/wiese_r/status/1227915344632778752
2/13/20 11:20,SugarmanSharna,Mikeggibbs,0,0,0,@TorontoStar @ElizabethMay @CochraneCBC @APTNNews @Tamara_APTN @SusanDelacourt @theJagmeetSingh @nytimes @Alyssa_Milano #IBelieveMikeGibbs #LGBTQ2 #MeToo #injusticeCanada,,@TorontoStar @ElizabethMay @CochraneCBC @APTNNews @Tamara_APTN @SusanDelacourt @theJagmeetSingh @nytimes @Alyssa_Milano,#IBelieveMikeGibbs #LGBTQ2 #MeToo #MeToo #injusticeCanada,1.23E+18,https://twitter.com/SugarmanSharna/status/1227915343575674881
2/13/20 11:20,SmBizAmerica,,0,4,3,Valentine_Ñés Day in the Workplace: Do_Ñés and Don_Ñéts #BarbaraWeltman @BigIdeas4SB https://bigideasforsmallbusiness.com/valentines-day-in-the-workplace-dos-and-donts/ #ValentinesDay #SmallBusiness #BusienssOwners #METOO #SexualHarassment #Workplace #HappyValentinesDay f/ @SmBizAmerica,,@BigIdeas4SB @SmBizAmerica,#BarbaraWeltman #ValentinesDay #ValentinesDay #SmallBusiness #BusienssOwners #METOO #METOO #SexualHarassment #Workplace #HappyValentinesDay #HappyValentinesDay,1.23E+18,https://twitter.com/SmBizAmerica/status/1227915322096836608
2/13/20 11:19,maatitv,,0,0,0,Check out our new episode of Maati Explains where we unpack pro women laws starting with the law that protects us from sexual harassment at workplace! https://www.youtube.com/watch?v=ZAF00Qu4Bxo #MeToo #SexualHarassment #genderequity,,,#MeToo #MeToo #SexualHarassment #genderequity,1.23E+18,https://twitter.com/maatitv/status/1227915100499120130
2/13/20 11:18,SilviaPaillanC,,0,0,0,Les juro que leÕ_ toda la informaciÕ_n asociada a este caso y en serio no podÕ_a creer que pese a un #8M y a movimientos como el #metoo #niunamenos pudiera seguir ocurriendo esto. Una_Ñ_ https://www.instagram.com/p/B8gU-dQlpl47zeesvQTzOuHGyHrlMC_Xo8jmto0/?igshid=ztxuj5fpwwdb,,,#8M #metoo #metoo #niunamenos,1.23E+18,https://twitter.com/SilviaPaillanC/status/1227915048963760130
2/13/20 11:18,Krystoferyoung,,0,0,0,"Au Japon, les espoirs d_Ñéun #MeToo tardif via @Mediapart",,@Mediapart,#MeToo #MeToo,1.23E+18,https://twitter.com/Krystoferyoung/status/1227915020304101378
2/13/20 11:18,WyndhamSusan,dontattempt,0,0,0,Anch_Ñéiophobia - fear of #metoo,,,#metoo #metoo,1.23E+18,https://twitter.com/WyndhamSusan/status/1227914835511267328
2/13/20 11:17,watanclub,,0,0,0,Weinstein jury set to hear closing from #MeToo skeptic ,,,#MeToo #MeToo,1.23E+18,https://twitter.com/watanclub/status/1227914797657870336
2/13/20 11:17,Neo_ChrySalis,Out__rage,0,0,1,_Ñ_Les amis de #Matzneff ne se contentaient pas d_Ñéadmirer son Å_uvre. Ils contribuaient Õ_ le protÕ©ger des autoritÕ©s;les ë‰liens d_ÑéamitiÕ©ë_ ont jouÕ© un rÕâle important ds l_Ñéattribution du prix #Renaudot Õ_ #Matzneff. [..]Les jurÕ©s littÕ©raires en #France sont totalement corrompus._ÑÒ #MeToo ,,,#Matzneff #Renaudot #Matzneff #France #MeToo #MeToo,1.23E+18,https://twitter.com/Neo_ChrySalis/status/1227914721413750785
2/13/20 11:17,SnowyEvergreen,MorningsMaria,0,0,1,"Can our Law be used for revenge, as opposed to Justice? ""The rule of Law"" has a dark side it seems, today. We have entered a time when we are a nation of laws, but innocent #MeToo men are the 1st in a long line of people against whom the law is used to destroy by people in Power",,,#MeToo #MeToo,1.23E+18,https://twitter.com/SnowyEvergreen/status/1227914632318398464
2/13/20 11:16,UnbFactsOk,,0,0,0,Weinstein Jury Set to Hear Closing From #MeToo Skeptic ,,,#MeToo #MeToo,1.23E+18,https://twitter.com/UnbFactsOk/status/1227914537317302272
2/13/20 11:16,MangoLassiPro,,0,1,1,Hoy Vibha D.M. nos habla de 'El escÕçndalo' (Bombshell). Film que habla de los acontecimientos que precedieron el movimiento #metoo y Time_Ñés Up. https://mangolassiproductions.com/tituloriginal-critica-el-escandalo-bombshell #timesup #JayRoach #charlizetheron #megynkelly #nicolekidman #gretchencarlson #margotrobbie #kaylapospisil,,,#metoo #metoo #timesup #JayRoach #charlizetheron #megynkelly #nicolekidman #gretchencarlson #margotrobbie #kaylapospisil,1.23E+18,https://twitter.com/MangoLassiPro/status/1227914437522313216
2/13/20 11:16,realDerksen,,0,0,8,"Dass das noch keine #Metoo Debatte geworden ist Wird die Arme so selten zum Kaffee eingeladen, dass sie gleich Verdacht schÕ_pft? #HennigWellsow",,,#Metoo #Metoo #HennigWellsow,1.23E+18,https://twitter.com/realDerksen/status/1227914345016893440
2/13/20 11:16,beellal,,0,0,1,»€„ÔÀâÀ_ Àâ»Å„ÔÀ_ Ö©„ê Àå»†À_»Å À_»†„Ô Àô»ÅÀ± Ö©„ê „ÅÀ_Ö© À_À_À_ Ö©„ê ÀËÀ_»_„ê »€„ÔÖ_ ÀŒÖ¥„Ô »_„ÔÀâ À±»ÅÀ_ »†À_„Å»_À± Ö©„Ô À_„ÔÀâ»_ Ö©»_À±»_ »_„ê ÖË»†»_Ö©À_À±„Å »€„ÔÀâÀ_ Àâ»Å„ÔÀ_ Ö©„ê „ÅÀ_Ö© À_À_À_ Ö©„ê ÀËÀ_»_„Ô »_À± À_»€À_À_À_ À±»_Ö© ÀË„Ô .@itsmeeshashafi #MeToo #alizafar @AliZafarsays #SupremeCourt,,@itsmeeshashafi @AliZafarsays,#MeToo #MeToo #alizafar #SupremeCourt,1.23E+18,https://twitter.com/beellal/status/1227914337551048705
2/13/20 11:15,Anto962,,0,0,0,#metoo @Stezzano https://www.instagram.com/p/B8gUnquIzUV/?igshid=1irorj0eem7ud,,,#metoo #metoo,1.23E+18,https://twitter.com/Anto962/status/1227914277526306818
2/13/20 11:15,badluck_jones,,0,0,0,La Resistance is no more! French Oscars succumb to #MeToo &amp; identity politics after new Polanski film gets TOO MANY nominations _ÑÓ RT Op-ed - https://www.rt.com/op-ed/480695-cesar-awards-polanskis-film/ via @RT_com,,@RT_com,#MeToo #MeToo,1.23E+18,https://twitter.com/badluck_jones/status/1227914243418345472
2/13/20 11:15,TALK1370,,1,0,0,HEADLINES: Weinstein jury set to hear closing from #MeToo skeptic ,,,#MeToo #MeToo,1.23E+18,https://twitter.com/TALK1370/status/1227914200099512321
2/13/20 11:15,Tituloriginal,,0,1,1,Hoy Vibha D.M. nos habla de 'El escÕçndalo' (Bombshell). Film que habla de los acontecimientos que precedieron el movimiento #metoo y Time_Ñés Up. https://mangolassiproductions.com/tituloriginal-critica-el-escandalo-bombshell #timesup #JayRoach #charlizetheron #megynkelly #nicolekidman #gretchencarlson #margotrobbie #kaylapospisil,,,#metoo #metoo #timesup #JayRoach #charlizetheron #megynkelly #nicolekidman #gretchencarlson #margotrobbie #kaylapospisil,1.23E+18,https://twitter.com/Tituloriginal/status/1227914145024167937
2/13/20 11:15,nohatemy,Alyssa_Milano,3,3,94,It_Ñés so sad how many people are enjoying watching _ÑÉyour crazy_Ñé everyday on twitter. #metoo as I am one of them enjoying this show.,,,#metoo #metoo,1.23E+18,https://twitter.com/nohatemy/status/1227914142809575425
2/13/20 11:15,majakstasko,,0,1,15,"Jak zareaguje Blanka LipiÅ†ska, gdy m—éÅ_czyzna zgwaÅ_ci oralnie kobiet—é, po czym powie, Å_e wczeÅ_niej go kokietowaÅ_a, a w gÅ_—ébi duszy tego chciaÅ_a? TeÅ_ odpowie, Å_e gwaÅ_ty to nudny temat? #MeToo #365dni",,,#MeToo #MeToo #365dni,1.23E+18,https://twitter.com/majakstasko/status/1227914109687140352
2/13/20 11:14,AndreaM09783220,MeTooMVMT,0,4,6,What about support groups for men who have been abused in a relationship? #JusticeForJohnnyDepp #metoo #mentoo,,,#JusticeForJohnnyDepp #metoo #metoo #mentoo,1.23E+18,https://twitter.com/AndreaM09783220/status/1227913818996539393
2/13/20 11:13,SkyblassMar,logicwillsaveus,0,0,2,#metoo is a #hollywood accessory . They don_Ñét care about sexual assault anymore than they do living breathing Americans,,,#metoo #metoo #hollywood,1.23E+18,https://twitter.com/SkyblassMar/status/1227913757952704514
2/13/20 11:13,GraemePatfield,reynarswan,1,0,0,"The point being: He is at work, so is she. How can any Hollywood actor in the #metoo era not be aware now that these kinds of 'jokes' just don't cut it any more? The best you can say is that he is ignorant and unprofessional.",,,#metoo #metoo,1.23E+18,https://twitter.com/GraemePatfield/status/1227913628856311808
2/13/20 11:13,sunscreendreams,,0,0,0,RT @hikingmyfeeling: Hey there! We're @sydneynotsyd and @Maker_of_Vibes and we are on a mission to get folks off the couch and onto the trail. #hikingmyfeelings #type2diabetes #believesurvivors #metoo #mentalhealth #vanlife,,@hikingmyfeeling @SydneyNotSyd @Maker_of_Vibes,#hikingmyfeelings #type2diabetes #believesurvivors #metoo #metoo #mentalhealth #vanlife,1.23E+18,https://twitter.com/sunscreendreams/status/1227913626406834176
